<?xml version="1.0" encoding="UTF-8"?>
<!--W3C Schema generated by XMLSpy v2009 sp1 (http://www.altova.com)-->
<xs:schema xmlns:xs="http://www.w3.org/2001/XMLSchema">
	<xs:element name="volatile" type="xs:boolean"/>
	<xs:element name="version" type="xs:string">

	</xs:element>
	<xs:element name="triggers">
		<xs:complexType>
			<xs:sequence>
				<xs:element ref="triggerGroup" maxOccurs="unbounded"/>
			</xs:sequence>
		</xs:complexType>
	</xs:element>
	<xs:element name="triggerGroup">
		<xs:complexType>
			<xs:sequence>
				<xs:element ref="trigger" maxOccurs="unbounded"/>
			</xs:sequence>
			<xs:attribute name="name" use="required" type="xs:string">

			</xs:attribute>
		</xs:complexType>
	</xs:element>
	<xs:element name="trigger">
		<xs:complexType>
			<xs:attribute name="name" use="required" type="xs:string">

			</xs:attribute>
		</xs:complexType>
	</xs:element>
	<xs:element name="stateful" type="xs:boolean"/>
	<xs:element name="scheduler-name" type="xs:string">

	</xs:element>
	<xs:element name="scheduler-instance-id" type="xs:string">

	</xs:element>
	<xs:element name="runningsince" type="xs:dateTime">
	</xs:element>
	<xs:element name="quartz-status">
		<xs:complexType>
			<xs:sequence>
				<xs:element ref="scheduler-name"/>
				<xs:element ref="scheduler-instance-id"/>
				<xs:element ref="version"/>
				<xs:element ref="jobs-executed"/>
				<xs:element ref="runningsince"/>
				<xs:element ref="group-names"/>
				<xs:element ref="jobs"/>
				<xs:element ref="triggers"/>
			</xs:sequence>
		</xs:complexType>
	</xs:element>
	<xs:element name="jobs-executed" type="xs:long">
	</xs:element>
	<xs:element name="jobs">
		<xs:complexType>
			<xs:sequence>
				<xs:element ref="job" maxOccurs="unbounded"/>
			</xs:sequence>
		</xs:complexType>
	</xs:element>
	<xs:element name="job">
		<xs:complexType>
			<xs:sequence>
				<xs:element ref="durable"/>
				<xs:element ref="stateful"/>
				<xs:element ref="volatile"/>
			</xs:sequence>
			<xs:attribute name="name" use="required" type="xs:string">
			</xs:attribute>
			<xs:attribute name="group" use="required" type="xs:string">
			</xs:attribute>
		</xs:complexType>
	</xs:element>
	<xs:element name="group-names">
		<xs:complexType>
			<xs:sequence>
				<xs:element ref="group" maxOccurs="unbounded"/>
			</xs:sequence>
		</xs:complexType>
	</xs:element>
	<xs:element name="group">
		<xs:complexType>
			<xs:attribute name="name" use="required" type="xs:string">
			</xs:attribute>
		</xs:complexType>
	</xs:element>
	<xs:element name="durable" type="xs:boolean"/>
</xs:schema>
